{
  "assessment_meta": {"assessment_id":"SC-REAL-009-A1","phase":"phase1","analyst":"Donna","review_status":"human_reviewed","assessment_date":"2026-03-16","notes":"Real manual screen using listing evidence plus limited public planning-context checks. Conservative placeholders retained where authoritative site-report fields were not fully verified in-session."},
  "site": {"site_name":"2 Bellevue Street, Bli Bli","address_text":"2 Bellevue Street, Bli Bli, Qld 4560","lot_plan":"Unknown in this pass","suburb":"Bli Bli","sunshine_coast_lga_check":true,"gross_site_area_sqm":0,"frontage_m":null,"access_notes":"Corner block per listing, but land size was not visible in this extraction. Exact frontage/access remains unverified."},
  "screening": {"residential_subdivision_use_case":{"status":"pass","notes":"Residential subdivision screening remains relevant, but evidence base is incomplete."},"current_zone":{"status":"unknown","zone_name":null,"verified_reference_needed":true,"notes":"Zone not verified."},"local_plan_precinct":{"status":"unknown","plan_name":null,"precinct_name":null,"verified_reference_needed":true,"notes":"Not verified."},"minimum_lot_size":{"status":"unknown","minimum_lot_size_sqm":null,"threshold_is_placeholder":true,"notes":"Not verified."},"effective_yield":{"status":"unknown","assumed_efficiency_ratio":null,"effective_yield_area_sqm":null,"indicative_lot_count":null,"notes":"Gross site area not captured from available extraction, so no yield view should be formed."},"constraints":{"frontage_access":{"status":"caution","notes":"Corner block is a positive access signal, but exact frontage and access configuration not verified."},"flood":{"status":"unknown","notes":"Flood not checked."},"steep_land_landslide":{"status":"unknown","notes":"Hazard overlays not checked."},"biodiversity_waterways":{"status":"unknown","notes":"Environmental overlays not checked."}},"prior_application_history":{"status":"unknown","relevant_history_found":null,"notes":"Not checked."}},
  "decision": {"score":40,"recommendation":"hold_verify","confidence":"low","critical_unknowns":["Gross site area not captured from current source pass","Current zone not confirmed","Local plan / precinct not confirmed","Minimum lot size / subdivision threshold not verified","Flood status not checked","Steep land / landslide status not checked","Biodiversity / waterways status not checked","Prior application history not checked"],"next_actions":["Confirm gross site area from listing or title source","Verify zone and precinct","Verify minimum lot size and overlays","Check history"]},
  "sources": [{"source_type":"manual_note","reference_text":"realestate.com.au listing: 2 Bellevue Street, Bli Bli, Qld 4560","url":"https://www.realestate.com.au/property-house-qld-bli+bli-150598260","verified":true},{"source_type":"manual_note","reference_text":"Listing states corner block and renovation potential, but land size was not captured in current extraction","url":"https://www.realestate.com.au/property-house-qld-bli+bli-150598260","verified":false},{"source_type":"planning_scheme","reference_text":"Sunshine Coast Council Development.i path identified but site-specific zoning/overlay data not fully verified in-session","url":"https://developmenti.sunshinecoast.qld.gov.au/","verified":false}]}
