{
  "assessment_meta": {"assessment_id":"SC-REAL-010-A1","phase":"phase1","analyst":"Donna","review_status":"human_reviewed","assessment_date":"2026-03-16","notes":"Real manual screen using listing evidence plus limited public planning-context checks. Conservative placeholders retained where authoritative site-report fields were not fully verified in-session."},
  "site": {"site_name":"18 Birch Street, Caloundra West","address_text":"18 Birch Street, Caloundra West, Qld 4551","lot_plan":"Unknown in this pass","suburb":"Caloundra West","sunshine_coast_lga_check":true,"gross_site_area_sqm":708,"frontage_m":null,"access_notes":"Quiet cul-de-sac residential access. No explicit corner or dual-access advantage identified in this pass."},
  "screening": {"residential_subdivision_use_case":{"status":"pass","notes":"Residential subdivision screening is relevant, though listing is renovation/add-value oriented rather than subdivision-led."},"current_zone":{"status":"unknown","zone_name":null,"verified_reference_needed":true,"notes":"Zone not verified."},"local_plan_precinct":{"status":"unknown","plan_name":null,"precinct_name":null,"verified_reference_needed":true,"notes":"Not verified."},"minimum_lot_size":{"status":"unknown","minimum_lot_size_sqm":null,"threshold_is_placeholder":true,"notes":"Not verified."},"effective_yield":{"status":"caution","assumed_efficiency_ratio":0.8,"effective_yield_area_sqm":566.4,"indicative_lot_count":null,"notes":"708sqm is a useful raw size, but without planning verification no indicative lot count should be asserted."},"constraints":{"frontage_access":{"status":"unknown","notes":"No verified frontage/access advantage established."},"flood":{"status":"unknown","notes":"Flood not checked."},"steep_land_landslide":{"status":"unknown","notes":"Hazard overlays not checked."},"biodiversity_waterways":{"status":"unknown","notes":"Environmental overlays not checked."}},"prior_application_history":{"status":"unknown","relevant_history_found":null,"notes":"Not checked."}},
  "decision": {"score":50,"recommendation":"hold_verify","confidence":"low","critical_unknowns":["Current zone not confirmed","Local plan / precinct not confirmed","Minimum lot size / subdivision threshold not verified","Flood status not checked","Steep land / landslide status not checked","Biodiversity / waterways status not checked","Prior application history not checked"],"next_actions":["Verify zone and local plan / precinct","Verify minimum lot size / frontage rules","Check overlays and history","Confirm whether 708sqm lot has credible subdivision pathway under local controls"]},
  "sources": [{"source_type":"manual_note","reference_text":"realestate.com.au listing: 18 Birch Street, Caloundra West, Qld 4551","url":"https://www.realestate.com.au/property-house-qld-caloundra+west-150216404","verified":true},{"source_type":"manual_note","reference_text":"Listing states 708sqm block with scope to enhance and add value; no explicit subdivision claim verified","url":"https://www.realestate.com.au/property-house-qld-caloundra+west-150216404","verified":false},{"source_type":"planning_scheme","reference_text":"Sunshine Coast Council Development.i path identified but site-specific zoning/overlay data not fully verified in-session","url":"https://developmenti.sunshinecoast.qld.gov.au/","verified":false}]}
