{
  "assessment_meta": {
    "assessment_id": "SC-REAL-001-A1",
    "phase": "phase1",
    "analyst": "Donna",
    "review_status": "human_reviewed",
    "assessment_date": "2026-03-16",
    "notes": "Real manual screen using listing evidence plus limited public planning-context checks. Conservative placeholders retained where authoritative site-report fields were not fully verified in-session. Re-evaluated on 2026-03-16 under refined recommendation logic."
  },
  "site": {
    "site_name": "39 Park Rd, Nambour",
    "address_text": "39 Park Rd, Nambour, Qld 4560",
    "lot_plan": "Unknown in this pass",
    "suburb": "Nambour",
    "sunshine_coast_lga_check": true,
    "gross_site_area_sqm": 598,
    "frontage_m": null,
    "access_notes": "Corner block per listing description. Frontage appears favourable at screen level but exact frontage dimensions not yet verified from authoritative mapping or survey."
  },
  "screening": {
    "residential_subdivision_use_case": {
      "status": "pass",
      "notes": "Target use case matches MVP scope. Listing explicitly markets redevelopment potential for duplex/townhouse outcome (STCA), which supports subdivision-style screening relevance."
    },
    "current_zone": {
      "status": "caution",
      "zone_name": "Medium density residential (listing claim only)",
      "verified_reference_needed": true,
      "notes": "Listing states medium density zoning, but authoritative council zoning map/site report was not fully verified in-session. Treat as indicative only pending official planning source confirmation."
    },
    "local_plan_precinct": {
      "status": "unknown",
      "plan_name": "Nambour local plan area likely relevant",
      "precinct_name": null,
      "verified_reference_needed": true,
      "notes": "Nambour local plan area is likely relevant based on suburb context, but exact precinct/site-specific local plan mapping was not verified in this pass."
    },
    "minimum_lot_size": {
      "status": "unknown",
      "minimum_lot_size_sqm": null,
      "threshold_is_placeholder": true,
      "notes": "Minimum lot size or equivalent subdivision threshold not yet verified from authoritative planning scheme controls for this site."
    },
    "effective_yield": {
      "status": "caution",
      "assumed_efficiency_ratio": 0.8,
      "effective_yield_area_sqm": 478.4,
      "indicative_lot_count": null,
      "notes": "Screen-level only. Gross area is modest at 598sqm; until zoning, frontage, servicing, and minimum lot size controls are confirmed, no reliable indicative lot count should be asserted."
    },
    "constraints": {
      "frontage_access": {
        "status": "caution",
        "notes": "Corner block is a positive signal for frontage/access flexibility, but exact frontage, crossover, and servicing constraints remain unverified."
      },
      "flood": {
        "status": "unknown",
        "notes": "Flood status not verified from council flood mapping in this pass."
      },
      "steep_land_landslide": {
        "status": "unknown",
        "notes": "Steep land / landslide overlays not verified from authoritative mapping in this pass."
      },
      "biodiversity_waterways": {
        "status": "unknown",
        "notes": "Biodiversity / waterway constraints not verified from authoritative mapping in this pass."
      }
    },
    "prior_application_history": {
      "status": "unknown",
      "relevant_history_found": null,
      "notes": "Prior application history not yet checked in Development.i / PD Online equivalent during this pass."
    }
  },
  "decision": {
    "score": 62,
    "recommendation": "proceed_with_caution",
    "confidence": "low",
    "critical_unknowns": [
      "Authoritative zoning confirmation outstanding",
      "Local plan / precinct not confirmed",
      "Minimum lot size / subdivision threshold not verified",
      "Flood status not checked",
      "Steep land / landslide status not checked",
      "Biodiversity / waterways status not checked",
      "Prior application history not checked"
    ],
    "next_actions": [
      "Obtain authoritative site report or council mapping output for zoning and local plan / precinct",
      "Verify minimum lot size and any frontage requirements from the applicable planning controls",
      "Check flood, steep land / landslide, and biodiversity / waterways overlays",
      "Check prior development application history for the site",
      "Confirm frontage and access dimensions from mapping or survey information"
    ]
  },
  "sources": [
    {
      "source_type": "manual_note",
      "reference_text": "realestate.com.au listing: 39 Park Rd, Nambour, Qld 4560 (property-house-qld-nambour-150132588)",
      "url": "https://www.realestate.com.au/property-house-qld-nambour-150132588",
      "verified": true
    },
    {
      "source_type": "manual_note",
      "reference_text": "Listing text states: 598sqm corner block, medium density zoning, duplex/townhouse redevelopment potential (STCA)",
      "url": "https://www.realestate.com.au/property-house-qld-nambour-150132588",
      "verified": false
    },
    {
      "source_type": "planning_scheme",
      "reference_text": "Sunshine Coast Council Development.i / site report path identified but site-specific zoning/overlay data not fully verified in-session",
      "url": "https://developmenti.sunshinecoast.qld.gov.au/",
      "verified": false
    }
  ]
}