{
  "assessment_meta": {"assessment_id":"SC-REAL-006-A1","phase":"phase1","analyst":"Donna","review_status":"human_reviewed","assessment_date":"2026-03-16","notes":"Real manual screen using listing evidence plus limited public planning-context checks. Conservative placeholders retained where authoritative site-report fields were not fully verified in-session."},
  "site": {"site_name":"27 Arundell Avenue, Nambour","address_text":"27 Arundell Avenue, Nambour, Qld 4560","lot_plan":"Unknown in this pass","suburb":"Nambour","sunshine_coast_lga_check":true,"gross_site_area_sqm":404,"frontage_m":null,"access_notes":"Vacant residential land. Services claimed connected in listing; exact frontage and access dimensions not verified."},
  "screening": {"residential_subdivision_use_case":{"status":"pass","notes":"Residential subdivision screening is relevant, but site is small enough that controls will be decisive."},"current_zone":{"status":"caution","zone_name":"Medium density (listing claim only)","verified_reference_needed":true,"notes":"Listing states medium density zoning, but authoritative council confirmation not obtained in-session."},"local_plan_precinct":{"status":"unknown","plan_name":"Nambour local plan area likely relevant","precinct_name":null,"verified_reference_needed":true,"notes":"Exact local plan / precinct not confirmed."},"minimum_lot_size":{"status":"unknown","minimum_lot_size_sqm":null,"threshold_is_placeholder":true,"notes":"Decisive for this small site and not yet verified."},"effective_yield":{"status":"unknown","assumed_efficiency_ratio":0.8,"effective_yield_area_sqm":323.2,"indicative_lot_count":null,"notes":"Site size is modest. Listing also states not duplex approved, which is a cautionary signal. No indicative lot count should be asserted."},"constraints":{"frontage_access":{"status":"unknown","notes":"Servicing and connections are positive if true, but frontage/access dimensions remain unverified."},"flood":{"status":"unknown","notes":"Flood not checked."},"steep_land_landslide":{"status":"unknown","notes":"Hazard overlays not checked."},"biodiversity_waterways":{"status":"unknown","notes":"Environmental overlays not checked."}},"prior_application_history":{"status":"caution","relevant_history_found":true,"notes":"Listing notes 3-block context and notes not duplex approved; that suggests relevant site/planning context but not an authoritative history review."}},
  "decision": {"score":58,"recommendation":"hold_verify","confidence":"low","critical_unknowns":["Authoritative zoning confirmation outstanding","Local plan / precinct not confirmed","Minimum lot size / subdivision trigger not verified","Flood status not checked","Steep land / landslide status not checked","Biodiversity / waterways status not checked","Actual planning/application history not checked"],"next_actions":["Verify current zone from council source","Verify minimum lot size / frontage rules","Check whether not-duplex-approved statement reflects a material planning constraint","Check overlays and history","Confirm lot dimensions and frontage"]},
  "sources": [{"source_type":"manual_note","reference_text":"realestate.com.au listing: 27 Arundell Avenue, Nambour, Qld 4560","url":"https://www.realestate.com.au/property-residential+land-qld-nambour-204010588","verified":true},{"source_type":"manual_note","reference_text":"Listing states 404sqm, medium density zoning, services connected, and not duplex approved","url":"https://www.realestate.com.au/property-residential+land-qld-nambour-204010588","verified":false},{"source_type":"planning_scheme","reference_text":"Sunshine Coast Council Development.i path identified but site-specific zoning/overlay data not fully verified in-session","url":"https://developmenti.sunshinecoast.qld.gov.au/","verified":false}]}
