{
  "assessment_meta": {
    "assessment_id": "SC-REAL-003-A1",
    "phase": "phase1",
    "analyst": "Donna",
    "review_status": "human_reviewed",
    "assessment_date": "2026-03-16",
    "notes": "Real manual screen using listing evidence plus limited public planning-context checks. Conservative placeholders retained where authoritative site-report fields were not fully verified in-session."
  },
  "site": {
    "site_name": "103 Carter Road, Nambour",
    "address_text": "103 CARTER ROAD, Nambour, Qld 4560",
    "lot_plan": "Unknown in this pass",
    "suburb": "Nambour",
    "sunshine_coast_lga_check": true,
    "gross_site_area_sqm": 756,
    "frontage_m": null,
    "access_notes": "Two driveways and double lockup garage noted in listing, which is positive at screen level. Exact frontage/access geometry and subdivision access practicality remain unverified."
  },
  "screening": {
    "residential_subdivision_use_case": {
      "status": "pass",
      "notes": "Target use case matches MVP scope. Site is within the candidate test set for residential subdivision screening."
    },
    "current_zone": {
      "status": "unknown",
      "zone_name": null,
      "verified_reference_needed": true,
      "notes": "Current zone not verified from authoritative council mapping/site report in this pass."
    },
    "local_plan_precinct": {
      "status": "unknown",
      "plan_name": "Nambour local plan area likely relevant",
      "precinct_name": null,
      "verified_reference_needed": true,
      "notes": "Nambour local plan context is likely relevant but exact precinct/site-specific local plan mapping was not verified in this pass."
    },
    "minimum_lot_size": {
      "status": "unknown",
      "minimum_lot_size_sqm": null,
      "threshold_is_placeholder": true,
      "notes": "Minimum lot size or equivalent subdivision threshold not verified from authoritative planning controls."
    },
    "effective_yield": {
      "status": "caution",
      "assumed_efficiency_ratio": 0.8,
      "effective_yield_area_sqm": 604.8,
      "indicative_lot_count": null,
      "notes": "756sqm is materially stronger than a smaller suburban lot and two driveways may help access flexibility, but without zoning, frontage, servicing and minimum lot size confirmation no reliable indicative lot count should be asserted."
    },
    "constraints": {
      "frontage_access": {
        "status": "caution",
        "notes": "Two driveways are a positive signal for access flexibility, but exact frontage and legal/practical access arrangement are not yet verified."
      },
      "flood": {
        "status": "unknown",
        "notes": "Flood status not verified from authoritative mapping in this pass."
      },
      "steep_land_landslide": {
        "status": "unknown",
        "notes": "Steep land / landslide overlays not verified from authoritative mapping in this pass."
      },
      "biodiversity_waterways": {
        "status": "unknown",
        "notes": "Biodiversity / waterway constraints not verified from authoritative mapping in this pass."
      }
    },
    "prior_application_history": {
      "status": "unknown",
      "relevant_history_found": null,
      "notes": "Prior application history not checked in Development.i / PD Online equivalent during this pass."
    }
  },
  "decision": {
    "score": 54,
    "recommendation": "hold_verify",
    "confidence": "low",
    "critical_unknowns": [
      "Current zone not confirmed",
      "Local plan / precinct not confirmed",
      "Minimum lot size / subdivision threshold not verified",
      "Flood status not checked",
      "Steep land / landslide status not checked",
      "Biodiversity / waterways status not checked",
      "Prior application history not checked"
    ],
    "next_actions": [
      "Obtain authoritative site report or council mapping output for zoning and local plan / precinct",
      "Verify minimum lot size and any frontage requirements from applicable planning controls",
      "Check flood, steep land / landslide, and biodiversity / waterways overlays",
      "Check prior development application history for the site",
      "Confirm whether the dual-driveway arrangement materially improves subdivision access practicality"
    ]
  },
  "sources": [
    {
      "source_type": "manual_note",
      "reference_text": "realestate.com.au listing: 103 CARTER ROAD, Nambour, Qld 4560 (property-house-qld-nambour-150455084)",
      "url": "https://www.realestate.com.au/property-house-qld-nambour-150455084",
      "verified": true
    },
    {
      "source_type": "manual_note",
      "reference_text": "Listing text states 756sqm block and two driveways with renovation scope",
      "url": "https://www.realestate.com.au/property-house-qld-nambour-150455084",
      "verified": false
    },
    {
      "source_type": "planning_scheme",
      "reference_text": "Sunshine Coast Council Development.i path identified but site-specific zoning/overlay data not fully verified in-session",
      "url": "https://developmenti.sunshinecoast.qld.gov.au/",
      "verified": false
    }
  ]
}
