{
  "assessment_meta": {"assessment_id":"SC-REAL-008-A1","phase":"phase1","analyst":"Donna","review_status":"human_reviewed","assessment_date":"2026-03-16","notes":"Real manual screen using listing evidence plus limited public planning-context checks. Conservative placeholders retained where authoritative site-report fields were not fully verified in-session."},
  "site": {"site_name":"58A Nambour Mapleton Road, Nambour","address_text":"58A Nambour Mapleton Road, Nambour, Qld 4560","lot_plan":"Unknown in this pass","suburb":"Nambour","sunshine_coast_lga_check":true,"gross_site_area_sqm":587,"frontage_m":null,"access_notes":"Standard house site with 2 carport spaces. No explicit corner or dual-access signal verified."},
  "screening": {"residential_subdivision_use_case":{"status":"pass","notes":"Residential subdivision screening is relevant, but listing itself is owner-occupier oriented rather than redevelopment-oriented."},"current_zone":{"status":"unknown","zone_name":null,"verified_reference_needed":true,"notes":"Zone not verified."},"local_plan_precinct":{"status":"unknown","plan_name":"Nambour local plan area likely relevant","precinct_name":null,"verified_reference_needed":true,"notes":"Not verified."},"minimum_lot_size":{"status":"unknown","minimum_lot_size_sqm":null,"threshold_is_placeholder":true,"notes":"Not verified."},"effective_yield":{"status":"unknown","assumed_efficiency_ratio":0.8,"effective_yield_area_sqm":469.6,"indicative_lot_count":null,"notes":"Lot size is modest and listing provides no strong redevelopment signal. No indicative lot count should be stated."},"constraints":{"frontage_access":{"status":"unknown","notes":"No verified frontage/access advantage established."},"flood":{"status":"unknown","notes":"Flood not checked."},"steep_land_landslide":{"status":"unknown","notes":"Hazard overlays not checked."},"biodiversity_waterways":{"status":"unknown","notes":"Environmental overlays not checked."}},"prior_application_history":{"status":"unknown","relevant_history_found":null,"notes":"Not checked."}},
  "decision": {"score":44,"recommendation":"hold_verify","confidence":"low","critical_unknowns":["Current zone not confirmed","Local plan / precinct not confirmed","Minimum lot size / subdivision threshold not verified","Flood status not checked","Steep land / landslide status not checked","Biodiversity / waterways status not checked","Prior application history not checked"],"next_actions":["Verify planning controls and overlays","Check history","Confirm frontage/access practicality"]},
  "sources": [{"source_type":"manual_note","reference_text":"realestate.com.au listing: 58A Nambour Mapleton Road, Nambour, Qld 4560","url":"https://www.realestate.com.au/property-house-qld-nambour-150545300","verified":true},{"source_type":"manual_note","reference_text":"Listing states 587sqm and central Nambour location; no explicit redevelopment claim verified","url":"https://www.realestate.com.au/property-house-qld-nambour-150545300","verified":false},{"source_type":"planning_scheme","reference_text":"Sunshine Coast Council Development.i path identified but site-specific zoning/overlay data not fully verified in-session","url":"https://developmenti.sunshinecoast.qld.gov.au/","verified":false}]}
