{
  "assessment_meta": {
    "assessment_id": "",
    "phase": "phase1",
    "analyst": "",
    "review_status": "draft",
    "assessment_date": "",
    "notes": ""
  },
  "site": {
    "site_name": "",
    "address_text": "",
    "lot_plan": "",
    "suburb": "",
    "sunshine_coast_lga_check": true,
    "gross_site_area_sqm": 0,
    "frontage_m": null,
    "access_notes": ""
  },
  "screening": {
    "residential_subdivision_use_case": {
      "status": "unknown",
      "notes": ""
    },
    "current_zone": {
      "status": "unknown",
      "zone_name": null,
      "verified_reference_needed": true,
      "notes": ""
    },
    "local_plan_precinct": {
      "status": "unknown",
      "plan_name": null,
      "precinct_name": null,
      "verified_reference_needed": true,
      "notes": ""
    },
    "minimum_lot_size": {
      "status": "unknown",
      "minimum_lot_size_sqm": null,
      "threshold_is_placeholder": true,
      "notes": ""
    },
    "effective_yield": {
      "status": "unknown",
      "assumed_efficiency_ratio": null,
      "effective_yield_area_sqm": null,
      "indicative_lot_count": null,
      "notes": ""
    },
    "constraints": {
      "frontage_access": { "status": "unknown", "notes": "" },
      "flood": { "status": "unknown", "notes": "" },
      "steep_land_landslide": { "status": "unknown", "notes": "" },
      "biodiversity_waterways": { "status": "unknown", "notes": "" }
    },
    "prior_application_history": {
      "status": "unknown",
      "relevant_history_found": null,
      "notes": ""
    }
  },
  "decision": {
    "score": 0,
    "recommendation": "hold_verify",
    "confidence": "low",
    "critical_unknowns": [],
    "next_actions": []
  },
  "sources": []
}
