{
  "assessment_meta": {"assessment_id":"SC-REAL-007-A1","phase":"phase1","analyst":"Donna","review_status":"human_reviewed","assessment_date":"2026-03-16","notes":"Real manual screen using listing evidence plus limited public planning-context checks. Conservative placeholders retained where authoritative site-report fields were not fully verified in-session."},
  "site": {"site_name":"18A Quambi Place, Buderim","address_text":"18A Quambi Place, Buderim, Qld 4556","lot_plan":"Unknown in this pass","suburb":"Buderim","sunshine_coast_lga_check":true,"gross_site_area_sqm":2652,"frontage_m":null,"access_notes":"Vacant land parcel with elevated position and private setting per listing. Exact frontage/access arrangement not verified."},
  "screening": {"residential_subdivision_use_case":{"status":"pass","notes":"Large vacant parcel is relevant to residential subdivision screening."},"current_zone":{"status":"unknown","zone_name":null,"verified_reference_needed":true,"notes":"Zone not verified from authoritative source."},"local_plan_precinct":{"status":"unknown","plan_name":null,"precinct_name":null,"verified_reference_needed":true,"notes":"Local plan / precinct not verified."},"minimum_lot_size":{"status":"unknown","minimum_lot_size_sqm":null,"threshold_is_placeholder":true,"notes":"Minimum lot size / subdivision trigger not verified."},"effective_yield":{"status":"caution","assumed_efficiency_ratio":0.8,"effective_yield_area_sqm":2121.6,"indicative_lot_count":null,"notes":"Strong raw site size, but topography/environmental and planning controls remain unresolved."},"constraints":{"frontage_access":{"status":"unknown","notes":"Vacant land gives flexibility but exact access/subdivision practicality not verified."},"flood":{"status":"unknown","notes":"Flood not checked."},"steep_land_landslide":{"status":"unknown","notes":"Elevated site makes this especially material and still unresolved."},"biodiversity_waterways":{"status":"unknown","notes":"Bush backdrop suggests environmental constraints may matter; not checked."}},"prior_application_history":{"status":"unknown","relevant_history_found":null,"notes":"No application history checked in this pass."}},
  "decision": {"score":61,"recommendation":"proceed_with_caution","confidence":"low","critical_unknowns":["Current zone not confirmed","Local plan / precinct not confirmed","Minimum lot size / subdivision threshold not verified","Flood status not checked","Steep land / landslide status not checked","Biodiversity / waterways status not checked","Prior application history not checked"],"next_actions":["Verify zone and local plan / precinct","Check minimum lot size and frontage rules","Check hazard/environmental overlays carefully","Check site history","Assess topography and access practicality"]},
  "sources": [{"source_type":"manual_note","reference_text":"realestate.com.au listing: 18A Quambi Place, Buderim, Qld 4556","url":"https://www.realestate.com.au/property-residential+land-qld-buderim-203931396","verified":true},{"source_type":"manual_note","reference_text":"Listing states 2,652sqm elevated private parcel suitable to build dream home (STCA)","url":"https://www.realestate.com.au/property-residential+land-qld-buderim-203931396","verified":false},{"source_type":"planning_scheme","reference_text":"Sunshine Coast Council Development.i path identified but site-specific zoning/overlay data not fully verified in-session","url":"https://developmenti.sunshinecoast.qld.gov.au/","verified":false}]}
